[{"geography":"48103","school_year":"2023-24","coverage":{"status":"missing","reason":"not_reported"},"imputed":false,"imputation_method":null,"provenance":[{"source_id":"texas-dshs-kindergarten-2023","url":"https://www.dshs.texas.gov/sites/default/files/LIDS-Immunizations/xls/2023-2024_School_Vaccination_Coverage_Levels_Kindergarten.xlsx","retrieved_at":"2026-10-07T02:27:22Z","sha256":"79d242139bfb4ca0247e90a588541bf14435db52f0a87fb1182535878232bbba","licence_id":"texas-dshs-terms-unconfirmed"},{"source_id":"texas-dshs-county-fips","url":"https://www.dshs.texas.gov/center-health-statistics/texas-county-numbers-public-health-regions","retrieved_at":"2026-10-07T02:30:41Z","sha256":"ea80fb5af16a53eb67d0a504dec9b1fcc159c8e5d4baf57d972aa21dacbfbd82","licence_id":"texas-dshs-terms-unconfirmed"}]},{"geography":"48301","school_year":"2023-24","coverage":{"status":"missing","reason":"not_reported"},"imputed":false,"imputation_method":null,"provenance":[{"source_id":"texas-dshs-kindergarten-2023","url":"https://www.dshs.texas.gov/sites/default/files/LIDS-Immunizations/xls/2023-2024_School_Vaccination_Coverage_Levels_Kindergarten.xlsx","retrieved_at":"2026-10-07T02:27:22Z","sha256":"79d242139bfb4ca0247e90a588541bf14435db52f0a87fb1182535878232bbba","licence_id":"texas-dshs-terms-unconfirmed"},{"source_id":"texas-dshs-county-fips","url":"https://www.dshs.texas.gov/center-health-statistics/texas-county-numbers-public-health-regions","retrieved_at":"2026-10-07T02:30:41Z","sha256":"ea80fb5af16a53eb67d0a504dec9b1fcc159c8e5d4baf57d972aa21dacbfbd82","licence_id":"texas-dshs-terms-unconfirmed"}]},{"geography":"48385","school_year":"2023-24","coverage":{"status":"missing","reason":"not_reported"},"imputed":false,"imputation_method":null,"provenance":[{"source_id":"texas-dshs-kindergarten-2023","url":"https://www.dshs.texas.gov/sites/default/files/LIDS-Immunizations/xls/2023-2024_School_Vaccination_Coverage_Levels_Kindergarten.xlsx","retrieved_at":"2026-10-07T02:27:22Z","sha256":"79d242139bfb4ca0247e90a588541bf14435db52f0a87fb1182535878232bbba","licence_id":"texas-dshs-terms-unconfirmed"},{"source_id":"texas-dshs-county-fips","url":"https://www.dshs.texas.gov/center-health-statistics/texas-county-numbers-public-health-regions","retrieved_at":"2026-10-07T02:30:41Z","sha256":"ea80fb5af16a53eb67d0a504dec9b1fcc159c8e5d4baf57d972aa21dacbfbd82","licence_id":"texas-dshs-terms-unconfirmed"}]},{"geography":"48433","school_year":"2023-24","coverage":{"status":"missing","reason":"not_reported"},"imputed":false,"imputation_method":null,"provenance":[{"source_id":"texas-dshs-kindergarten-2023","url":"https://www.dshs.texas.gov/sites/default/files/LIDS-Immunizations/xls/2023-2024_School_Vaccination_Coverage_Levels_Kindergarten.xlsx","retrieved_at":"2026-10-07T02:27:22Z","sha256":"79d242139bfb4ca0247e90a588541bf14435db52f0a87fb1182535878232bbba","licence_id":"texas-dshs-terms-unconfirmed"},{"source_id":"texas-dshs-county-fips","url":"https://www.dshs.texas.gov/center-health-statistics/texas-county-numbers-public-health-regions","retrieved_at":"2026-10-07T02:30:41Z","sha256":"ea80fb5af16a53eb67d0a504dec9b1fcc159c8e5d4baf57d972aa21dacbfbd82","licence_id":"texas-dshs-terms-unconfirmed"}]}]