[{"geography":"30","school_year":"2023-24","coverage":{"status":"missing","reason":"not_reported"},"imputed":false,"imputation_method":null,"provenance":[{"source_id":"cdc-schoolvaxview-kindergarten","url":"https://data.cdc.gov/resource/ijqb-a7ye.json?$select=vaccine,dose,geography_type,geography,year_season,coverage_estimate,foot_notes,survey_type&$where=year_season%20in%28%272023-24%27,%272024-25%27%29%20AND%20%28vaccine%3D%27MMR%27%20OR%20%28vaccine%3D%27Exemption%27%20AND%20dose%3D%27Any%20Exemption%27%29%29&$order=year_season,geography,vaccine&$limit=5000","retrieved_at":"2026-10-07T02:27:44Z","sha256":"36dde045aff5579612edced09a49f47bcb8a607a40dbf7b0332aed5428d378d6","licence_id":"cdc-schoolvaxview-terms-unconfirmed"}]},{"geography":"30","school_year":"2024-25","coverage":{"status":"missing","reason":"not_reported"},"imputed":false,"imputation_method":null,"provenance":[{"source_id":"cdc-schoolvaxview-kindergarten","url":"https://data.cdc.gov/resource/ijqb-a7ye.json?$select=vaccine,dose,geography_type,geography,year_season,coverage_estimate,foot_notes,survey_type&$where=year_season%20in%28%272023-24%27,%272024-25%27%29%20AND%20%28vaccine%3D%27MMR%27%20OR%20%28vaccine%3D%27Exemption%27%20AND%20dose%3D%27Any%20Exemption%27%29%29&$order=year_season,geography,vaccine&$limit=5000","retrieved_at":"2026-10-07T02:27:44Z","sha256":"36dde045aff5579612edced09a49f47bcb8a607a40dbf7b0332aed5428d378d6","licence_id":"cdc-schoolvaxview-terms-unconfirmed"}]},{"geography":"54","school_year":"2024-25","coverage":{"status":"missing","reason":"not_reported"},"imputed":false,"imputation_method":null,"provenance":[{"source_id":"cdc-schoolvaxview-kindergarten","url":"https://data.cdc.gov/resource/ijqb-a7ye.json?$select=vaccine,dose,geography_type,geography,year_season,coverage_estimate,foot_notes,survey_type&$where=year_season%20in%28%272023-24%27,%272024-25%27%29%20AND%20%28vaccine%3D%27MMR%27%20OR%20%28vaccine%3D%27Exemption%27%20AND%20dose%3D%27Any%20Exemption%27%29%29&$order=year_season,geography,vaccine&$limit=5000","retrieved_at":"2026-10-07T02:27:44Z","sha256":"36dde045aff5579612edced09a49f47bcb8a607a40dbf7b0332aed5428d378d6","licence_id":"cdc-schoolvaxview-terms-unconfirmed"}]}]